{
  "schema": "book-analysis-taxonomy-interpreter-roundtrip/v1",
  "format_id": "book-analysis-taxonomy/v1",
  "plugin_id": "com.plotpilot.novelagent.donor-analysis",
  "capabilities": [
    "analysis.book.atom.extract/v1",
    "analysis.book.atom.manual/v1",
    "analysis.book.claim.generate/v1",
    "analysis.book.rereview/v1"
  ],
  "forward_direction": "format_to_capability",
  "reverse_direction": "capability_to_format"
}

